author,text,likes,published_at
@gokarnaacharya6499,हर्के लाई ढुङा बोक्न ठिक थियो किन होला भोट दिएको धराने जन्ताले 🤔🤔🤔 यसरी त पुरानै दल हरु लाई फाइदा पुग्ने भो हर्क को कारान ले गर्दा  ।। कसतो न बुझेको हर्क ?? यसैत पुराना दल हरु दाना पानि  बन्द भएर सर्कार लाई दोश लगाउने र न्वारान देखि बल लगाका छन कसरी हुन्छ सर्कार ढाल्न लाई,0,2026-05-25T03:57:18Z
@diwaslama1499,Rabdi ko xora ghante ko joley muji,0,2026-05-25T03:57:13Z
@govindamagar2498,"हर्केलाई 
ऐंठन मात्र भएको हैन 🙈 
बालेन 
प्रधानमन्त्री भएर राम्रो काम गरेकोमा 
महाऐंठन भएको हो ✌️🇳🇵💯🇳🇵🇳🇵🇳🇵🇳🇵🇳🇵🇳🇵🇳🇵🇳🇵🇳🇵🇳🇵🇳🇵🇳🇵🇳🇵🇳🇵🇳🇵🇳🇵🇳🇵🇳🇵🇳🇵🇳🇵🇳🇵🇳🇵🇳🇵🇳🇵🇳🇵🇳🇵🇳🇵🇳🇵🇳🇵🇳🇵🇳🇵",5,2026-05-25T03:57:08Z
@RajKumar-vq5rh,"Harkya muji pm hoinaw 
Gothalako KO layak Pani xaina",0,2026-05-25T03:55:44Z
@ARick_499,HARKA SAMPANG is king❤,0,2026-05-25T03:55:29Z
@KajiThapa-l2r,Asta paster kukur harke aukat bas sala thak🤣😅,0,2026-05-25T03:54:38Z
@ARick_499,Harka Sampang is greatest poltical leader 🎉❤,0,2026-05-25T03:54:32Z
@sharbalallamgade1569,Harke ko mukh ma Ladies period pad le mukh band garnu parxa 😂😂😂,0,2026-05-25T03:54:26Z
@rimixbindas5210,हर्क पहिला त ठिकै लाग्थ्यो तर अहिले किन यस्तो हुँदै छ। के अहिलेको नया भनिएको पाटी पनि  मुखमात्र बजाएर बस्नु पर्ने?? नत्र के को लागि बिरोध प्रधानमन्त्री नबोलेको कुरामा यत्रो बिरोध?? के बिकास नचाहेको नै होत?,0,2026-05-25T03:53:30Z
@thapindrasigdel5510,अरुकेहि हैन याे पास्टरेले पास्टरसम्बन्धि प्रचार गर्न नपाएर हाे याे बाैलाएकाे।,6,2026-05-25T03:53:16Z
@reshamlamsal271,यो m.g हर्के को काम छैन 🙏🙏🙏,0,2026-05-25T03:50:04Z
@MaheshSunam-h2u,एस्लाइ बादर धपाउने काम दिनु राम्रो हुन्छ ...हर्के लाई सुहाउदो काम एहि हो,0,2026-05-25T03:49:37Z
@T.GDailekhi12,"पत्रुकार जि, सरकार सांसद प्रती जवाफ देहि हुने कि नहुने,? सधै लुकेर भागेर देश चल्छ,? एकतर्फी समाचारको कारण पनि देश यो गतिमा गयको हो ,, र यहाँ आयर गाली गर्ने गजेडी र सहकारी ठगको नालायक कुकुरहरूले यो बुझेको छैन प्रतीक्ष पनि जनताको आवाज हुन भनेर ,सरकारले अर्थात मन्त्री प्रधानमन्त्री ले जवाफ दिनु पर्छ , भागेर लुकेर हुदैन यो कुरा घण्टे पत्रुकार लाई पनि हेक्का होस,, जहिल्यै जनता लाई मेनुपुलेट गर्ने पत्रुकार यता खाडी आउ सङ्गै बेल्चा हानौला",0,2026-05-25T03:48:49Z
@ratand-dasgurung5157,Yo harkey shyal guithey ko k kura garnu karauni kam ho karai rakhxa k hi makho mardaina,0,2026-05-25T03:48:41Z
@pawanoli6392,3 seat Harke Aafno Aukat Tha xa ni ?,0,2026-05-25T03:48:34Z
@MilanraiRainepa,Mg thagko jhole,0,2026-05-25T03:48:26Z
@Bishnu-qn3ec,Harka belagam jantu ko,0,2026-05-25T03:48:21Z
@NgawangSherpa-i6n,lamichaney ko jhole putrukar 😂😂,0,2026-05-25T03:47:51Z
@Sayrakark,Thokka harke,0,2026-05-25T03:47:43Z
@Durga.durgatinashini.111,Pakhey harke,0,2026-05-25T03:47:24Z
@MadanPoudel-l8g,प्रधानमन्त्री संसद प्रती जवाफदेही नहुन पर्ने हो??? अब रा स्व पा ले बिकल्प खोज्नै पर्छ ।,0,2026-05-25T03:47:19Z
@KamalAbhinashTamang,Harke and followers are idiots they must be punished,0,2026-05-25T03:44:21Z
@Anime-tw4nc,Chayao ta pm ta 👊,0,2026-05-25T03:42:58Z
@LaxmiSapkota12,बिना मेसै बकबक गरेर भाईरलहुने काक😡,0,2026-05-25T03:38:28Z
@Rongkop2,Yahi ho one man is enough to wake up the parliament,1,2026-05-25T03:35:35Z
@BlackBelt-z7n,"हर्के गुईठे घाँस खाने नै रैछ, पतनकाे बाटाे हिडेकाे छ गुईठे, राम्रो ठानेकाे याे मुजिलाई काम न लाग्ने घाँस रैछ । बालेनकाे अगाडि याे मुजिलाई तुलना गर्न मिल्दैन्🔔🔔🔔🔔",0,2026-05-25T03:35:09Z
@Rongkop2,Jay mato,1,2026-05-25T03:34:25Z
@gurunggaming797,Harka Sampang ja vaneko thiyo tyo sab thik vannu vako ho,0,2026-05-25T03:31:13Z
@PunamBk-g1r,yo harke gada lai lathanera lakhetnuni salekukurlai,0,2026-05-25T03:28:23Z
@Gghggfghnhhjn,Khate hark,0,2026-05-25T03:26:54Z
@ramilaghimire7796,Yo harke lai kina nanikaleko😮😮😮,0,2026-05-25T03:25:25Z
@Leo-bx3bs,"How narcissistic can a person be ? He has literally named a thinking behind him and he expect people to follow it and accept it.. ""Mao bad"" comes from Mao from China.. and Harka wants HARKABAD...",0,2026-05-25T03:24:38Z
@lilarajadhikari,कुल र मुल साेधेर काम गर्नु भनेझैं हर्के पुर्ब माअेाबादि भयकाेले उग्रवादी भयकाहुन यस्ता उग्र लाइ उग्र रुप बाट नियम कानुन बाट हटाउनु पर्छ,0,2026-05-25T03:24:31Z
@bharatghimire6239,हर्कै हल्दार को काम छैन।,1,2026-05-25T03:24:06Z
@ibemhal,यो हर्केलाई शुरु देखि मिडियाले अनावश्यक महत्व दिएर फुर्केको ।,8,2026-05-25T03:23:56Z
@RupeshBastakoti,Yestho pagal harky jastho manxy samsad huni deserve gardaina yeslie vote dini pani kastho manxy k dykhyra diyo hola lagxa,0,2026-05-25T03:22:56Z
@KumarKb-k3t,"यो झोले खाते लाई निलम्बन होस् 
यो खाते बढी नै भाको छ अब यसलाई नेपाल सरकारमा कुनै जागिर पा पाउनी गरी बर्खास्त होस्।
यस्ता रेबिज लाई हटाउन पर्छ",6,2026-05-25T03:22:31Z
@mrsiwakoti,Harka need immediately psychiatrist medical treatment,0,2026-05-25T03:21:32Z
@gm6234,Harkey lai nilamban gardiu,0,2026-05-25T03:18:36Z
@naamchhaina4200,Nilamban thoknu parxa harkelaaii pagal ho harke,0,2026-05-25T03:18:32Z
@ExpatGurung,यो साले खाते बालेनको आची जति पनि होईन के को Ego ?,0,2026-05-25T03:17:57Z
@RajBhatrai-q6m,हर्के चोर हो पागल QR ठग,0,2026-05-25T03:17:01Z
@NagendraPoudyal,Chanda uthai Khana palkeka thag haru yo desh KO mantri bandainan,0,2026-05-25T03:16:46Z
@Sherpagamers,हावा धरी मिडिया हर्क सम्पाङ ले भनेको नियम १५ चहि तेरो कान 👂 फुटेको छ त्यसमा पनि कुरा गरौ मिडिया RSP party हो थुक बिर्सेको 😂😂😂,1,2026-05-25T03:11:26Z
@KaramjitRai-k5p,Yeslai jalan vako ho balen pradhan mantri vayekoma,0,2026-05-25T03:10:30Z
@hiramagar2752,"को हर्क 
यस्तो पागल पछाडी लाग्न थाले प्रत्रकार",0,2026-05-25T03:09:58Z
@mankunwar6832,बालेन साहा सङ राजीनामा माग्न कत्तिको झायेज हो व तेयो प्रकिरिय ले नै बोल्नुपर्छ त्रर भन्देेेे ग्रदा साम्पाङ ज्यु ले ल  मत हिने भनेर हिने पसि निस्किनु तेयो शहेलि कत्तिको झायेज हो,0,2026-05-25T03:09:34Z
@hiramagar2752,"सहकारी पिडितलाइ सधै पिडित बनाएर राजनीति गर्ने दाउपेचमा , सहकारी पिडितले पैसा पाएकोमा हर्कराज राई अत्यन्तै दुखी छन - रातदिन निदाउन सकेको छैनन । यिन्लाइ जनताको समस्या र समाधान को बिचमा बसेर राजनीति गर्दै भोट बैंक स्थापना गर्नु छ । जसरी पनि प्रधानमन्त्री बन्ने सपना देखेका छन । सरकार २४ घन्टालाई भएपनी अनौपचारिक प्रधानमन्त्री भएको घोषणा गर्दे । plz",0,2026-05-25T03:09:06Z
@aahaan1240,Jungali haru sahar pase paxi..halat yehi hunxa...,0,2026-05-25T03:08:41Z
@chulgurung5292,हर्कको संसदको पद खारेज  गरिदिनुस मोहदाय,61,2026-05-25T03:08:06Z
@KhilnathBastola-d9h,हर्के ले देश मा अराजक गराउन चाहान्छ एस्ता अराजक लाई बेलैमा एस्ता लाई बाइपास गराउदा राम्रो।। हर्के पागल हो जे पनि बोल्न र गर्न सक्छ है,0,2026-05-25T03:07:56Z
@RaajKumar-yq6cf,"हर्क बाद,❌❌❌❌
व्यक्तिवाद ✅✅✅✅
😂😂😂😂😂😂",0,2026-05-25T03:07:35Z
@susant81,"हर्कको अर्कै भित्री कथा छ जस्तो लाग्छ, सरकार होशियार भएर चल्नु पर्छ, देशमा जातीय, साम्प्रदायिक र भौगोलिक बिखन्डन र बिकाश अवरोधको लयमा देखिए जस्तो महशुस हुन्छ । वास्तविकतामा के हो र किन प्रधानमन्त्री पछि हात धोएर लागेको हो ? बुझ्न जरूरी छ ।",0,2026-05-25T03:07:26Z
@DjdjsgtubFjc,सम्सद बाटै निलम्बन हुनु पर्छ यो गुइठे,0,2026-05-25T03:04:30Z
@raiprakash3057,सरकार जवाफ देहि हुनु पर्छ तँ पत्रकार  नियमलि  १५ को २ को किन कुरा गरिनौ त ! तँ स्वातन्त्र पत्रकारिता गर,0,2026-05-25T03:04:15Z
@PurnaShahi-s4l,Pagal harke,0,2026-05-25T03:03:37Z
@SushilNeupane-e5v,"haina tapaile yo news the thik xa dekhaunu bho. aaba aauta news update gardinu na yo hawaldar le qr marfat leko paisako ko k ho khash kura tyo ni clear gardinush na.. yesle paisa khako xaina ta? yo news ni dherai jana hami tapaiko regular viewer lai ni confusion xa. chadai gardinu hola. yo harka pahile maobadi ko chanda atanka dekhi qr, beshar factory, appointment dharan nagarpalikama sabai.",0,2026-05-25T03:02:14Z
@rajutamang4693,हर्के चोरसालालाई सदनबाट लखेट्नु पर्छ।,1,2026-05-25T03:01:47Z
@misguided7620,"श्रमदानको नाममा लाहुरेहरूसँग चन्दा उठाएर, चन्दाको पैसाले पार्टी सञ्चालन गर्ने र प्रधानमन्त्री पदका लागि गरिब र सुकुम्बासीको नाममा गरिने राजनीति नै हर्कवाद हो।",35,2026-05-25T03:01:39Z
@Buddha-Limboo,Tero patrakarita pani heriraxa janta le sahakari thag lai xutdeko bare chup chap xas aaja harka lai naramro dekhaunu khojdaixas haina gadha,0,2026-05-25T03:00:34Z
@sandevluhar9291,1000 भन्दा कम भएको साथी यता हाजीर हौ 🙏,0,2026-05-25T02:59:43Z
@Thefinalcut9457,Jhole putrakar 😊😊,0,2026-05-25T02:58:52Z
@milanpariyar9734,3 sit lera pm banna pauxa rw kanun ma tei vra tw rajinama mageko hola qr le😂😂,0,2026-05-25T02:57:08Z
@milanpariyar9734,6 maina ko pm ma balen le sath diyena vnera teii ris le ho ego guethe ko kaam xaina,0,2026-05-25T02:56:12Z
@sanjivlama9,Harke muji daran mai thik thiyo,0,2026-05-25T02:55:21Z
@limbuneedon,Yaslai laat hanera samsad batai khedawnu parxa,2,2026-05-25T02:55:07Z
@sumitmandal2520,Hami harka li ab ghrinaa garxau ab..yo pagal ho,0,2026-05-25T02:53:52Z
@royzo-mipo,यो पागल हो भन्दै छ जेनजीले र 20 वर्ष सम्म जेलमा हाल्नुपर्छ भन्दै छ जेनजीले,0,2026-05-25T02:52:00Z
@Gp_Rx,हर्क ले गरेको कै हर्कत सही नहोला तर एजेन्डा सही छ बालेन दुई तिहाई को दम्बले चुलिदैछ यस्तैहो भने उनिआफ्नै कारण ले आफैलाई अफ्ट्यारो मा पार्दैछ।,0,2026-05-25T02:51:18Z
@mayakhadka9529,हामी स्कुलजादा एउटा सर आउनु भएन  भनेर घर जान पाउछौर हर्के,5,2026-05-25T02:51:15Z
@GopiPoudel-l1v,Pradhan Mari hunalai ta haisiyat hunxa paryoni ta😂😂😂😂,0,2026-05-25T02:51:06Z
@babishshrestha7030,Bichara harke Pradhan mantri huna ta payena aba sungur haruko adhaxya bhayera bas QR master yesko Pani xanbin hunu parxa.yesta harami haru sansad ma chahidaina..bato banaune paisa Pani khayeko xa re yo sungure le,0,2026-05-25T02:50:59Z
@fulmayapandey1993,अरु साम्सद कोहि बोलेको छन यो हर्क को काम छैन यो निलम्बन हुन जरुरि छ सबै जनता ले हेरि रहेका छ्न बुझ्न  जरुरि छ दादागिरी  चदैन,0,2026-05-25T02:50:54Z
@niranjanbista2748,Esta nathe lai jitayesi estai ho,0,2026-05-25T02:48:32Z
@bil4249,हर्क होईंन गोरू हो,0,2026-05-25T02:46:52Z
@DramaRecap11,Balen le chai question ko answer Dina sakdaina k para ho. At least bolnu tw paro harka le jasari berod gare pani balen le answer dinu parxa transparent government is needed. Result pani dekindaina in 1st week jasto speed pani dekindaina. Need more speed news herna alxi lagna thali sako.,0,2026-05-25T02:44:43Z
@bhisank.c6972,पाँच सिटीले आम जनताको मत लत्ताउन पाउँदैन।,85,2026-05-25T02:44:27Z
@KHIMBAHADURRIMAL,Harka g meyor banne layek ko Pani hoina samsad kasari hunu bhayo Khai byabar ta hat bajarma phrsi ka munta bechne byapari ko jasto xa ajhai herdai jam Kati samma Tala jharnu hunxa tyo ta Janata le herna Baki nai xa,0,2026-05-25T02:39:37Z
@sulazchhetriolee,Pagal Gu khanxa yeslay 😂,0,2026-05-25T02:37:06Z
@suryadawadi1120,Pagalbad😂😂,1,2026-05-25T02:36:22Z
@Nepalfanko,😂❤,0,2026-05-25T02:35:35Z
@TravellingWithKal,Is Blen under Influnce in drugs ?,0,2026-05-25T02:33:56Z
@bharatsunar2145,"हर्के जस्तो घृणित दुष व्याक्ती यो संसदमा लायक छैना,संकटकालमा नक्कली मावोवादी बनेर चन्दा आतंक मच्चाउदै लुट्यो,मेयर भएसी श्रमदाता बन्दै लुट्यो,अहिले संसद भएसी क्युआर मार्फत पैसा उठाउदै लुटेको छ,न यस्को हिसाबकिताब देखायको छ,पारुहाङको मुर्ति बनाउना 14 करोड उठेको तर सम्बन्धित व्याक्तीहरुले हिसाबकिताब माग्दा पनि दियन,तर कसरी दियोस् त सबै लुटेरा खाएको छ,यो नालायक लुटेरालाई यहि मुद्दा लायर जेल हाल।सरकार",0,2026-05-25T02:33:45Z
@khemapandey3847,Jay janta ko sarkar🙏🌹,1,2026-05-25T02:33:13Z
@MR_DHAMI64,QR party chaldain,0,2026-05-25T02:31:49Z
@suryadawadi1120,Yo harkea chor ko pachade harana khukur haseko sala 😅,0,2026-05-25T02:31:38Z
@shadowsvlog2912,Samsadiya niyam chai..kebal.. kebal… harka sampang lai matra lagdo rahixa hai.. balen chai… xada goru jhai… huda..bal nai… xahina….Sarkar ko  janta saga jodiyeko janjiban ko  prasna rakhana pani napauune…Prime Minister chahiyo .. prasna ko utar pauuna banda..samsad ma na auune.. bipakshi ko prasna ko question face garna nasake? Yo democracy ho autocracy ho..RSSP ko MP haru.. janata ko kar… ko bhata kayera….. parliament… na aauda ni bal xahina.. yes ma chai samsadiya marida ka go?….Niti tatha kariyakram pess huda balen …. Prime minister justo manxe … samsahiya mariyada haat handa.. chai… kai na hune….RSSP.. haru le chai….21 jana MP .. bhuee ma basne… kitap padne…birod gare .. ko thiyo ta .. theti khera chai.. samsadiya mariyada chai .. ka gako thiyo RSSP ko…?…Sida kura.. k ho bane balen …RSSP ko.. hali vanyera basdai na.. j manlagxa tai garxa….. RSSP ko haru just afunu  Laz bachau na just balen ko galti cover garna khojdai xa..,1,2026-05-25T02:31:14Z
@rameshpandey9194,यो हरके लाई  वेटेनरी मा लगेरा भैसी लाई लगाउने सुई लगाऊना पाए कस्तो होला ।,0,2026-05-25T02:28:58Z
@AnitaDarlami-z3i4u,Yo harke pasu ho ki manxe khai pasuko bebar dekhauxa,1,2026-05-25T02:27:25Z
@TheLocalBoy-1,"Ahile  Nepal ma kuni jhole media ho vane tyo sidha Kura ho 
PM,ra Minister hru le parliament ma janta KO question KO answer Dina aaudaina tyo yo media le boldaina",0,2026-05-25T02:27:17Z
@gwyaljen,हर्क साम्पाङ प्रतिपक्षी दलको नेताको सरकारले गर्ने कामको गुण र दोषको आधारमा आलोचना गर्दा के भयो त महोदय ?,0,2026-05-25T02:26:33Z
@ramkarki7955,K bhannu ho harne lai,0,2026-05-25T02:25:24Z
@samikchhya-n7g,हर्क सापाङ नेपाल को एकमात्र हो नेपाल बचाउने अरु छैन,0,2026-05-25T02:24:00Z
@anoop.x12,esta guithe le bolauda baal Nadine hamro balen KO habits+attitude 😂❤jay balen balen le desh banauna aako aako ho aru le bolayo bhane Jane bolne karaune ufrine garna aako hoina... Narendra Modi Le bolauda ta Gayena esta nathe guithe le bolauda baal hamro balen lai😂😂,0,2026-05-25T02:22:39Z
@nabinchamling8403,"यो  sidhakura MEDIA ले manipulation गर्न खोज्दै छ,,,, होसियार!!!!",0,2026-05-25T02:21:32Z
@NarayanShrestha-j9z,Ghante ko bikash sahkari thagne dhukuti bat pidit Lai paisa badne 😂😂😂😂😂😂,0,2026-05-25T02:21:25Z
@Da0907-v4s,Harke lost his mind. Please expel him.,0,2026-05-25T02:20:02Z
@raimaila-e2t,Aba sakiyo ghante kharni,1,2026-05-25T02:19:58Z
@Tsewanglama,let him work . you stupid good for nothing,0,2026-05-25T02:19:28Z
@RabinRai-ro5ob,Purpley newyus  vayena. Research garnu brother yek choti tq.,0,2026-05-25T02:18:43Z
@narayang.c6933,Harka Ghar Pharka timro kasm xaiba,0,2026-05-25T02:18:32Z
@reshampurja6996,Good reporting👍️👍️,1,2026-05-25T02:18:10Z
@Chandramagar-u2k,Rip sarkar,3,2026-05-25T02:17:40Z
@yuvahamal2192,हर्के सभासद भन्दा टिकटक तिर लागे हुन्छ ।,6,2026-05-25T02:16:52Z
@sadevbudhathoki-ql1fd,Harke thag😡😡😡,0,2026-05-25T02:16:16Z
@Narsu66,Balen shah PM Vako harke jaler marna lagisakyo. Jelasi harke,0,2026-05-25T02:16:00Z
@JagirmanRai-h2t,हर्क भन्दा असल नेता नेपाल मै छैन हर्क साम्पाङ्ग लाई चेतावनी त दिए अब संस्पेन्ड गरेर देखाव। हर्क को जन्म त्यसै भएको होइन यो देश बनाउन आफ्नो माहाङ् पारु हाङ्ग सुम्निमा को आशिर्वाद को कारण यो धर्तिमा जन्म लिएको हुन। मान्छे हरुले बुजेको छैन तर बिस्तारै बुज्नेछन जान्नेछन😢,1,2026-05-25T02:15:14Z
@NarayanShrestha-j9z,Sahakari thagne ghante le piditlai rakam dine desh ko hamro kar bat thukk ghante sarkar ra tinka bharute haru,0,2026-05-25T02:14:53Z
@PushpaGurung-q5k,Kukur lai gheu pachdaina balen ko maya khera gayo,0,2026-05-25T02:14:51Z
@PuskarAdhikari-p7h,हर्के लाई प्र म  होइन   हवलदार  सम्म  को पद मात्र ठिक  छ।😂😂😂😂😂😂,10,2026-05-25T02:14:00Z
@UpashGhimire,Harke le purano Lai ni fail garaideko xa.. satta ma ni Naya pratipakchya ma ni Naya 😅,0,2026-05-25T02:13:28Z
@sonibam2613,हर्क लाई नियम १५ को २ झापड दिनु परो😂😂😂,61,2026-05-25T02:12:39Z
@UmeshSingh-ll7zg,यो माचिक्ने हर्के खातेले,2,2026-05-25T02:12:20Z
@RajaramMahat-u6i,हर्क को हर्कत देखदा त धराने जनताले के सोच्नेहोला त भन्नुस त पोइला त कति राम्रो बेभार देखाउनु भाको थियो अईले त किन घमण्ड देखाको होला बुज्न गारो छ छि,6,2026-05-25T02:12:11Z
@peacehappiness6734,"हर्केले बालेनकाे लाैराे चुनाव चिन्न नभएको भए मेयर जित्दैन थ्याे। उ आफुलाई असाध्यै जान्नेसुन्ने र शक्तिशाली ठान्छ तर वास्तविकता उ केही पनि छैन् र हैन्। उ सबैलाई आफ्नो मुर्खे जिद्दीले तह लगाउन खाेज्छ।
उसले अहिले त्यहि मुर्खे जिद्दी गरेर तह लगाएर देखाउन खाेज्दैछ। बालेनले यस्ता छुसीलाई बाेल्दैे नबाेली र वास्तै नगरीकन ठेगान लगाईदिन्छन्।
यस्ता पागल संग जुधेर समय बर्बाद गर्ने पनि हैन्। त्याे मुला कराईरहन्छ।",5,2026-05-25T02:12:05Z
@rabindra1838,yo harke lai nikalna parcha,0,2026-05-25T02:11:24Z
@suvakamana-e9r,Harke party nai kharej gardinu paro nirbachan aayog le,1,2026-05-25T02:11:11Z
@AmbikaPhuyal-qg9ig,प्रधानमन्त्री बन्न नपाए र अजै हर्के को अहङ्कार र घमण्ड कम भयको छैन।केपी ओली को भर्सन टू हो हर्क साम्पाङ बेलैमा जनताले बुझ्न जरुरी छ।,16,2026-05-25T02:10:37Z
