author,text,likes,published_at
@ghanagiri9996,Balen saga badla,0,2026-05-25T07:41:53Z
@BireTamang-u6c,सुँगुर खानेको बुद्दी यस्तै हुन्छ🌹बुद्दी छैन हर्केको 🌹यस्तै बानिले हर्के ले धेरै  दु:ख पाइन्छ🙏बुद्दी नै जिब्रोमा हुन्छ 🌹घमण्ड ले कस्तो कस्तो के के भयो सबै लाई थाहा नै छ🙏म पनि तमाङ्ग हो 🌹🙏र म साकाहारी हु 🌹🙏हर हर महादेव🌹🙏,0,2026-05-25T07:38:00Z
@ArcyyBlox,ईगो हो यो दलाल को,0,2026-05-25T07:37:55Z
@SEPNdi,Nilamban gare ta hera desh aago balxa yaad rakhos,1,2026-05-25T07:36:19Z
@Yukesh-thapa-69,हर्के मुजि पागल हो।😂😂😂,0,2026-05-25T07:35:52Z
@santoshtimalsina5345,Sungur lai khor ma thik hunxa samsad ma hoina 😡👊,0,2026-05-25T07:25:21Z
@d21gaming89,Junai jogi aayeni kanai chireko vaneko yei ho,0,2026-05-25T07:25:00Z
@Basantchepang14,Hatayekai ramro jai ghanti,0,2026-05-25T07:24:54Z
@fun_media-hindi,Harka Sampang is KP Oli 2.0,0,2026-05-25T07:16:28Z
@toyotabhai6037,काङ्ग्रेस यमीले को बिरोध गरदैन हर्कले किन होला,0,2026-05-25T07:15:49Z
@dhanrajrai5255,Harka le matrai khojeko ho ra???,0,2026-05-25T07:14:25Z
@deepakmaharjan5022,Tyasta mula guithe lai pm banay janta sabai dhuga bokaun Dharan lancha jantha le.  No pm yasta Maobadi ko chauro lai,0,2026-05-25T07:11:26Z
@kulbdrsitaula7596,Harke manxe hoina kp oli ko gadha ho thukka 🔔🔔🔔🔔🔔🔔💪🏻💪🏻💪🏻💪🏻💪🏻💪🏻💪🏻,0,2026-05-25T07:05:53Z
@mhmqusyairi6825,यो पाखण्डी लाई धरानको जनता ले किन नबुझेको होला,0,2026-05-25T07:03:25Z
@AmeenAmeen-t9j,Balen birodi matrai Haina yho nathe tta desh ko bikash birodhi nae ho. Daran ma Pani eslai kasaile pataudaena  boli ra bewar Le garda,0,2026-05-25T07:02:44Z
@AnilGadal-s7h,राजनीति आउन नमिल्ने गरि एस्लाइ निलम्बन गर्नु परो,0,2026-05-25T06:59:40Z
@sisnudhedo75,The speaker must reign over disorderly Harkey and should literally throw him out of parliament.,0,2026-05-25T06:58:48Z
@prabinrai7814,15ko2 first hunu parcha,0,2026-05-25T06:56:44Z
@prabinrai7814,One man army👍💪💪💪💪,1,2026-05-25T06:55:08Z
@BandanaRai-m8z,Yo sidhakura lai negative  kura bahek aru garnu aaudain ki k ho??,0,2026-05-25T06:53:03Z
@npraj2102,पत्रकार ले अनी १५ को २ हर्क ले भनेको चाई किन पढेर नसुनको? के छ त्यसमा? सभामुख ले सम्झाको पढेर सुनाए पछि हर्क ले पनि सुनाको पढेर जनता लाई यो रैछ भनेर जानकार गर्नु पर्दैन?,0,2026-05-25T06:48:27Z
@Furba44,Yo khate harke le political instability lyauna khojdaixa pakhe ! Manxe le mann ramro boli matra kharab bhanxan tara malai tw yo khate ko mann thik xa jasto lagna xodisakyo,0,2026-05-25T06:47:35Z
@GNewsgaoule,Balen is great❤🔔🔔🔔👈️,0,2026-05-25T06:46:58Z
@BijayRaiThulung-f1e9s,Aru sarkhar huda kurchi tebul torfor voko ho naya kuro hain hajur sir😊,0,2026-05-25T06:46:25Z
@deomanlimbu5852,"यो मिडिया र अहिलेको सरकार एउटै हुन कि क्या हो आफ्नो आंङमा हात्ती हिडेको नदेख्ने अर्काको आंङमा जुम्ब्रा हिडेको मात्र देख्ने सोसियल मिडिया भनेको सत्यतथ्य के हो त्यो दिनु पर्छ नत्र सरकार पक्ष भएर कहिले पनि पत्रकारिता नगर्नुहोस् भन्नु चाहन्छौं ।
नम्बर १ प्रधानमन्त्री बेगरको देश प्रधानमन्त्री बेगरको सदन प्रधानमन्त्री बेगरको जनता भनेको अर्थहिन हुनेछ यसको कुनै औचित्य हुने छैन । त्यसैले यसलाई सरकारको सबैभन्दा ठुलो गल्ती हो भन्ठानेका छौ ।
भने पछि हाम्रो प्रधानमन्त्री को जवाफ चाहियो सभामुख ज्यु प्रधानमन्त्री देश भित्रै छन् र बिमारी छैनन् भने नियमले ल्याउनु पर्ने हुन्छ  भन्दा केको गल्ती केको निलम्बन ????
संसारमा कहि नभएको बदनाम कमाउने सरकारले गर्नु खोजेको चाहिन के ??????
जय माटो जय देश ❤️❤️❤️❤️❤️🇳🇵🇳🇵🇳🇵🇳🇵🇳🇵💪💪💪💪💪",0,2026-05-25T06:43:57Z
@ezal2071,Nonstop and Nonsense 😂😂😂😂😂😂😂,1,2026-05-25T06:39:35Z
@ninashrestha5873,केपिको अर्को रूप . यलाई संसदबाट निकाल्नु पर्छ । जय रवि जय घण्टी,0,2026-05-25T06:38:19Z
@duluwaa7,3 seatey PM😂😂😂,0,2026-05-25T06:38:03Z
@Khadia-j6o,हर्क वाद होइन Qr वाद हो,0,2026-05-25T06:36:58Z
@sapanalama9435,"Yo harka pagel lai nilaman gar nu par cha , Pagel harka bauela kukur",0,2026-05-25T06:32:19Z
@susanchristian8752,Yestai muji harule garda desh bikash na vako garne lai garna nadine ani sabai khana matrai khojne ani vanne bikash gardaina yo sarkar 😡😡😡yo mujiko ta thoprai dekhera rish uth hau,0,2026-05-25T06:27:54Z
@MandipBhandari-k1k,Harka paster ho rai limbu party 😂😂😂,0,2026-05-25T06:27:15Z
@Bishalwaiba-b1t,कसतो राडिको छोरा रैछ यो पनि अबो यसको घर मा जानू परछज्सतो छ सरकार ले हामरो कुरा सुन्नु पर्दैन यो पत्र्कार को मुखम मेरो लाडाे हल्नु पर्ने रैछ मुजि,0,2026-05-25T06:20:15Z
@bhaikajibhandari5695,Timichai yesto nango hunegari rabiko bhakta banna xada bhai patrakaar ya mediakarmi hau bhane nispakshya khalko videos banau.abata yo sida kura bhanne program nai rabi lamichhne le timlai chalauna lagsko jasto lagnathaisako,0,2026-05-25T06:14:28Z
@originalchannel5703,🙏🏻🙏🏻,0,2026-05-25T06:13:17Z
@sujanpoudel4643,जती विरोध हर्क जी ले गर्नु हुन्छ त्यति नै राम्रो balen जी लाई हुने हो 😂😂,0,2026-05-25T06:11:30Z
@tangsangthalang1795,Jay mato jay desh 🇳🇵🙏🏻,2,2026-05-25T06:11:12Z
@Bhee-May,तिमी जतिको घण्टीको मुखपत्रले अर्को सामपानी प्रति यतिको विश्लेषण गर्छ भन्ने पनि आशा थिएन। जे भएपनि धन्न हर्कवादको विषयमा जानकारी दिएछ,0,2026-05-25T06:10:06Z
@AsherRai-q9f,Harke bhaneko eekle dhedu ho,0,2026-05-25T06:09:02Z
@nimashyonzan7596,Rsp reporter…?,0,2026-05-25T06:07:05Z
@DurgaLimbu-s5e,Balen media😂😂😂,0,2026-05-25T06:06:38Z
@user-laxmangiri,यो सुङ्गुर हर्के खाते कुल्ली,0,2026-05-25T06:00:37Z
@yogeshlimbu1372,Ghanti pati ko patrukar😂😂,0,2026-05-25T05:59:51Z
@LovelyRose-s9k,जय हकॅ बाद🙏💕💕🇳🇵सत्यको  एकदिन जिदं  हुन्छ जय माटो🇳🇵🇳🇵🇳🇵,1,2026-05-25T05:59:48Z
@sarojkasaju3677,Dui kaudi ko harke ko ego😂😂,0,2026-05-25T05:58:57Z
@ishwarpallitngl,Atankabaad bidrohi harka sampang bahiskar hnu parxa😮,0,2026-05-25T05:58:53Z
@JuliocesarVillalobos-s9x,Harke jasto pagal nai  Samsad ma  Mananiya  bhayo bhame yo Samsad  lai ke  bhanne ??,0,2026-05-25T05:58:09Z
@thepostman02,"यिनि लात खाने भुत हुन, बातले मान्दैनन। सभामुख महोदय 🙏",0,2026-05-25T05:56:05Z
@shworrame7434,Mula tin site sungurko Kam xaina sadhaiko lagi bida bhaya jhan Ananda hune thiyo.,0,2026-05-25T05:56:02Z
@thepostman02,धराने जनताहरु पछुताउदैछन 😢,1,2026-05-25T05:54:59Z
@animeedits-h9e,Irshya ley manchey KO...budhii nash huncha vanthey ho raicha,0,2026-05-25T05:54:30Z
@LhapsangKarpo9,"Good Job!
Jai Nepal ❤
Jai Balen ❤",0,2026-05-25T05:52:49Z
@joshiakabar7305,Thik xa harkeko kura. Balen ghamandi hudai gaako xa,0,2026-05-25T05:51:26Z
@RoshanSuchikar-y3n,hark lai bycut garam arazkta pati,0,2026-05-25T05:50:31Z
@RoshanSuchikar-y3n,balen le kam garnu vako xa,0,2026-05-25T05:49:41Z
@RabinRai-s5t,"Nepal ma pani godi media aaaipugyo , kati poisha khaiyo broooo",0,2026-05-25T05:48:44Z
@RoshanSuchikar-y3n,Harke oli ko choro,0,2026-05-25T05:48:39Z
@JuliocesarVillalobos-s9x,Yo pagal Harke bahulayo ki ke ho. ?,0,2026-05-25T05:45:23Z
@kcganesh3973,लिल्बन गरनु सर्छ,0,2026-05-25T05:43:58Z
@thapaliquors,"Harke aba media trayel ma fasyo, gayo samsad pad khaais aba harke guithe, 😂😂😂😂",1,2026-05-25T05:37:57Z
@munakhanal8269,Yo harke lai khedaunu paro,0,2026-05-25T05:37:33Z
@Prakashdangi609,यो मान्छे गलत छ जस्को हर्कतले पुस्ट्टी गर्छ! एस्ता ब्यात्तीबाट कहीलै देशमा सान्त्ती हुदैन हर्कलाई बहीस्कार गरौ नत्र देशको लागि घातक हुनसक्छ ✍️✍️✍️✍️🔔🔔🔔🔔🔔,0,2026-05-25T05:34:26Z
@Ajaygurung-114odv,Pagal kukur Harke,0,2026-05-25T05:34:00Z
@SagarSharma-c9x,Harke mujhi dalal joker ho,0,2026-05-25T05:33:29Z
@basantashrestha8404,Harke को harkat herda teslai चिडियाखानामा lagera राख्नुपर्छ,4,2026-05-25T05:31:38Z
@arjunentertainment9055,सबै हर्कको🤣गल्ती देखायो यो पत्रुकार ले तर बालेन को गल्ती देखाएन झोले ले के कारन ले यस्तो हुदैछ भन्ने प्रस्ट पार्न सकेन रास्वपा झोले ले,0,2026-05-25T05:30:21Z
@रावातावासेरोफेरो,"प्रधान मन्त्री बिनाको संसद बैठक के अर्थ हुन्छ?
आफ्नो बिहेमा अर्को बेहुला पठाउँदा हुन्छ?",0,2026-05-25T05:30:00Z
@prempariindu5901,सङ्गैकाे साथी प्रधानमन्त्री भएकाेमा डाहाँ गरेकाे हर्केले अरु केही हाेईन,0,2026-05-25T05:25:42Z
@49krashmiofficial67,यो हर्केको मुख हेर्दनै बादर जस्तो छ झन ब्यहार त बादरको नै छ,0,2026-05-25T05:24:43Z
@sorajshahi,"Harkabad zindabad
Jay hos",0,2026-05-25T05:24:02Z
@bhimbahdurbhandari6153,हर्के qr को नाममा ठगी गर्ने गिरोहमा एक नम्बरमा छ।,0,2026-05-25T05:23:08Z
@nimeshghimire7385,harka le bhaneko chai k ho ? tyo niyam chai khai bhaneko ? ghante media. .,2,2026-05-25T05:21:41Z
@bhimbahdurbhandari6153,"हर्के बाद होईन हर्के विवाद हो, यो हर्के आरिसे प्रवृदिको कपटयुक्त पास्टर हो। यसले देशको भलो भन्दा आफ्नो दुनो सोझ्याउने मनसायले भरिएको छ।",0,2026-05-25T05:21:40Z
@bulandaaawajnepaltv5993,थुक्क तोइले त जनजाती को नै बदनाम गर्यो यार,0,2026-05-25T05:21:24Z
@DipakKhadka-l7l,guithe ko pani rajneeti sakiyo ... aba arko chunaav ma 284 seat liyera aawnu ani sansad chalawnu 3 seat lyayera furti garnu pardaena laaj saram xaena,0,2026-05-25T05:21:13Z
@sudenrajbhandari9158,"हर्क र उनका समर्थकहरूलाई निलम्बन नै गर्नुपर्छ। दुई-तिहाइ मत पाएको पार्टीलाई नेपाली जनताले त्यसै भोट दिएका होइनन्। हर्क जस्तो जातीय मतका आधारमा आएका व्यक्तिहरूलाई, १८२ सिट दिएर जनताले सुम्पेको यो जनमतलाई अवरोध गर्ने कुनै अधिकार छैन। यस्ता अन्धभक्त र गैरजिम्मेवार व्यक्तिहरूलाई तत्काल निष्कासन गर्नु नै सबैभन्दा राम्रो विकल्प हो।",4,2026-05-25T05:19:33Z
@bulandaaawajnepaltv5993,यो साले खाते हर्क आतंककारी हो,0,2026-05-25T05:18:56Z
@nabinpanta8815,बालेन कम गर्न आएका हुन तर हर्क बोल्न र विरोध गर्न मात्र फरक यही हो,0,2026-05-25T05:18:36Z
@LilHanuman-7,हर्क देशको कलंकको ऎसलाई निकाला गर्नु पर्छ।,0,2026-05-25T05:18:19Z
@Mr.Bikashyt1,Next time pattasaf hunxa Qr,0,2026-05-25T05:18:15Z
@jeevanthapa-sg9ms,Harke boot ho😆😆😆fff ko,0,2026-05-25T05:16:33Z
@RabinMagar-e7f,हर्के पागल को कुरा नगरू हो 😂😂😂😂,0,2026-05-25T05:15:50Z
@UnishaLama-v4k,Yo harki ta pagal ho ki k ho🤪🤪,0,2026-05-25T05:15:14Z
@DevkumarRijal-j4p,"एउटा भ्यागुताले जङ्गलको पोखरिमा पानी पिउन आएको ऐरावत हात्तिलाई तैले पानी पिउन पाउदैनश यस्मा मेरो अधिकार छ यदि मेरो आज्ञा वा  अनुमति विना पानी पिउन खोजीस भने लात्तले हानेर लडाई दिन्छु भन्ने त्यो भ्यागुता र हर्के एउटै हुन। जनताको ताजा जनादेशले बृहत् शदस्य शंख्या सहित वालेन प्रधानमन्त्री बनी देश चदाउदा नाथे ६ सिटे हर्के प्रतिपक्षिको पनि पुछारमा रहेकोले म प्रधानमन्त्री हुनु पर्छ, म चलाउछु शरकार भन्नू त्यो पाजी भ्यागुता जस्तै हो। हर्के नेपालकै घमन्डी, माकाफुई र मपाईत्व छाट्ने आडम्वरी, ईर्श्यालु वन्दैछ जुन कुरा उशैका लागि धेरै हानिकारक वन्दैछ।",0,2026-05-25T05:14:15Z
@ramthapamagar5954,केको हर्कबाद हो मूला क्यूआरबाद हो,0,2026-05-25T05:13:14Z
@HMTRANDOM,हर्क सांङपांग पागल 2:11 😮,0,2026-05-25T05:11:55Z
@durgasubba9854,Big salute harka sir,0,2026-05-25T05:11:10Z
@snkrsrstha5377,Bhag harke tero churifuri derai  bhayo,0,2026-05-25T05:06:11Z
@serizawatamao4946,"12 dekhi majale paddai garnu paryo
eniharuko vharosa ma nepal xodna sakdina 🇳🇵 😢",0,2026-05-25T05:01:32Z
@timromuskan9462,Harke pagal ho,0,2026-05-25T04:55:56Z
@samirshakya1342,Yestaaaa harkey samsat ma basna layek ko manchee haina janta ley ramrori kaam gar vanera 2 /3 diyeko ho pelera nai aagadi baad pm balen timi aafno kaam garera aau ani matra brief garney ho mailey yo yo garey vanera 30 barsa ko fohor safa gardai garda naya fohor pani sangai barera lagdue,0,2026-05-25T04:55:19Z
@sovarai2699,ढुङ्गा बोक्नी हैसियत भयेको हर्क लाई सान्सद पद पायेर धेरै घमण्ड बडेकाे छ । म आफू मात्रै राम्रो अरु सबै नराम्रो भन्ने सोच हर्क को दिमाग बाट निकाल्न जरुरी छ ।,0,2026-05-25T04:54:52Z
@sarusilwal6699,मन्त्री बन्न नपाएकाे आकराेस हाे याे ।,0,2026-05-25T04:54:44Z
@bishnubhandari8112,chetawani hoina yaslai nilamban garnu parxa.,0,2026-05-25T04:53:54Z
@UNEXPECTED-77-r6y,21 सिट जिदा पहिला रासपाले निलो स्कारर्फ लायेर बिरोध गर्दा मर्यादा भो बालेन्को झोले मिडिया 😂😂😂😂,1,2026-05-25T04:53:34Z
@krishnabahardurprashain8645,हर्के ले भनाइमा राजीनामा dineho,0,2026-05-25T04:52:56Z
@NabinbeghaLimbu-mv1jk,Niyam ko 15 pani vanna jhole media,0,2026-05-25T04:49:21Z
@Hari-j1n,"संसदबाट बालेन  प्रधानमन्त्री बने, तर बालेन एकपटक पनि संसदमा बोलेका छैनन् ,सरकारका निति तथा कार्यक्रम  राष्ट्रपति द्वारा संसदमा प्रश्तुत गरिरहदा बालेन बिचमा उठेर हिडेर अनुशासनहिन र अमर्यादित व्यवहार देखाए, त्यसपछि  प्रधानमन्त्री न संसदमा अाए न सांसदहरुको प्रश्नको जवाफ दिए,बालेन संसद प्रति जवाफदेही र उत्तरदायित्व देखाएनन् ,त्यसैले फलस्वरूप हर्क साम्पाङले बिरोध गरिरहे ,बिरोध को शैली हातमा पम्प्लेट देखाएर गरे ,अन्य बिपक्षी  सांसदहरूले  पनि बिरोध गरिरहे ,,सभामुख संसदको स्वतन्त्र हुनुपर्नेमा राश्वपाको मात्रै जस्तो व्यवहार देखाए ,प्रधानमन्त्रीलाई संसदमा उपस्थित हुन रुलिङ गर्न नसक्ने सभामुख तठस्थ देखाउन सकेनन् र संसदको गरिमा कायम गर्न सकेनन्",0,2026-05-25T04:47:20Z
@AshokTamang-x9h,Yo ucha aadalat ko mananiya ni change huna jarure. Bhai bandi gare rako x testo ni hunx.,0,2026-05-25T04:46:00Z
@PrakaashNathYogi,Suspend him,0,2026-05-25T04:43:24Z
@R75758,🙏ONLY THE KING OF KINGDOM OF NEPAL HARKA SAMPANG 💪💪✊🙏,0,2026-05-25T04:40:21Z
@tekrajkapadi8238,Kam xain yasto harkeko,0,2026-05-25T04:39:55Z
@316GRGYUBA,अभद्र ब्याबहार गरिरहे निलम्बन आबश्यक छ।,0,2026-05-25T04:39:01Z
@loksewasahayatri,"बकमफुसे हावादारी हर्के !!!
चुपचाप धरानतिर फर्के😅",0,2026-05-25T04:36:56Z
@remnantj.b.official,ptrukhakar,0,2026-05-25T04:35:06Z
@PRK.gorkhali,यो रासापा को media हो अफ्नो पार्टीको गल्ती देख्दैन,1,2026-05-25T04:34:11Z
@maniac-z3o,Harke PM banyo vani ta marigaye NEPAL basdina,0,2026-05-25T04:33:09Z
@HemSangita,harke madari,0,2026-05-25T04:32:02Z
@sthapitshan1052,K yesto Goethe ko kura hami nagarik le sunnu parne ho r?,0,2026-05-25T04:31:55Z
@MalatiThapa-l1z,Harke sampag ko samsad pad Nilmbha griyos ati arajak bhayo harka ji .,0,2026-05-25T04:31:52Z
@devnarayansapkota4566,Goru harke kukur,0,2026-05-25T04:31:36Z
@kkg8785,nilamban gare hunchha yo jungali sungur lai...,0,2026-05-25T04:30:57Z
@हिमालआले,सला हर्के पस्तारलाई निलन्बन गर्नु पर्छ यो क्युआर कोतेलाई,0,2026-05-25T04:28:50Z
@rambk8994,Harke runche 😂😂,0,2026-05-25T04:25:50Z
@ChetanKhatri-v6v,👍️👍️👍️👍️🙏🙏🙏,0,2026-05-25T04:24:29Z
@PemaRupesh,"श्रम स्रस्कृती, नाम अनुसारको व्यबहार भएन। के पारा देखाको यो??? पहिला जति प्रसङ्स हुन्थ्यो अहिले त्यो भन्दा बढी आलोचना भैरहेको छ यो कुरा बुज्नुपर्ने हो। त्यस्तै पर्यो भने निलम्बित पनि गर्न बाध्य हुनेछन् सभामुख ।",0,2026-05-25T04:23:13Z
@kamalJeena716,Harke Pagal ho,0,2026-05-25T04:22:29Z
@Goku_Sir,Jay mato,1,2026-05-25T04:21:22Z
@Tobehonest480,Yo guithe laii vote dinu nai thulo shrap ho,0,2026-05-25T04:18:41Z
@KamalNepal-y8l,Harke 😂 Pagal ho,0,2026-05-25T04:15:24Z
@RamkumarRajbanshiRamkumarRajba,"Harke ek international country ko paster ho, Nepali Hindu lai creation religion ma change garne kam garx ,paisa chanda mager church ma invest garx r baki paisa afno goji ma halx 🥺🥺",1,2026-05-25T04:15:21Z
@gunjaksthapa2721,😂😂 harkelae nilamban vako din herna paam 😂😂,0,2026-05-25T04:14:39Z
@SugamTamang-t1u,Herdai ja muji ghante haru aba kasari hallauxa 5 site le. Harkeko pawar dekhxas aba bistarai. Ta harule,0,2026-05-25T04:14:24Z
@Ruslan-k9c,गुइथे,0,2026-05-25T04:13:57Z
@laxmanthapa1157,"😂 प्रधानमन्त्री बन्न नपाए को रिस्, केपी ओली को नी बाप् निस्के 😅",4,2026-05-25T04:13:55Z
@DurbakcNepal,Harki ko egoo,0,2026-05-25T04:12:48Z
@DurbakcNepal,Hakri  ko ego dherai xa,0,2026-05-25T04:12:40Z
@RF彡SurenDra,Harke pagal mula,0,2026-05-25T04:12:34Z
@Nbkirat-revolution,संसद्मा हर्कले बलेनको विरोध गरेको होइन सरकारको विरोध गरेको हो भनेर समाचार लेख्नु है।,0,2026-05-25T04:12:18Z
@hakimdai4333,He is crazy,0,2026-05-25T04:11:43Z
@morty4429,Gawarbad guithye pastor,0,2026-05-25T04:11:40Z
@Pyara_Suraj,He is the Mamta Banerjee of Nepal 😂. He will see in the next election!! All the best Harkey 🙏🌺,0,2026-05-25T04:11:24Z
@thecreativeman6087,"हर्के, गुईठे ,अहंकारी घमण्डी ,पातकी ! सबैभन्दा म राम्रो हुँ भनेर हर्कवाद नारा चलाउन खोज्दैछ, यस्ताे व्यक्ति देशको नेतृत्व पुग्यो भने डुबाउँछ।",1,2026-05-25T04:10:01Z
@MadanBk-h7u,🙏🔔👌🔔👌🔔👌💞🔔💞🔔✊🔔✊✊✊✊,0,2026-05-25T04:07:39Z
@youko7357,Harke rajinama dee kaam xain tero,0,2026-05-25T04:07:30Z
@DineshRai-tz6sg,अगाडि बढ्नुस् हर्क जी! Your role has been appreciated! यो सरकारलाई सफल बनाउनुपर्छ।,0,2026-05-25T04:07:14Z
@AmitGhimire-g4q,Baulaa paastar,0,2026-05-25T04:04:27Z
@tasmishra8218,हर्क पागल हो,0,2026-05-25T04:04:03Z
@NarendraMagar-q6k,अब हर्केलाइ pm बनाउन पर्ने भयो 😂😂,0,2026-05-25T04:01:20Z
@Amritdarnal64Amritdarnal64,Yasto pagal harka KO Kura kasle manchha ta ho,0,2026-05-25T04:00:39Z
@Kimjonbudhathoki,सुंगुरको अनुहार परेको हर्क सामपाङ गधालाइ पागल भनेर चिन्छौ,0,2026-05-25T04:00:12Z
@Rana-Magar7,हर्के सीआईए को एजेन्ट हो बिस्तारै पर्दाफास हुँदैछ  धैर्य गर्नु होला😒,1,2026-05-25T03:59:53Z
@guruchalise-o7n,"झोले मिडिया मुला
प्रधानमन्त्रीलाई जवाफदेही बनाउनु गलत हो र?",2,2026-05-25T03:58:28Z
@ShivaBhattarai-g4d,हर्के काम छैन,0,2026-05-25T03:58:22Z
@ranjiott,Harke chor,0,2026-05-25T03:58:21Z
