author,text,likes,published_at
@sukhzen4285,Ooo! Harka sampang ko re video dekhayara paisa Kathe pawxa?,0,2026-05-25T12:22:53Z
@astrophiletrades,Pagal bhegute mug,0,2026-05-25T12:21:42Z
@NikeshChhetri-p6s9g,Yesko kin video banauxan k yo…mu..g ko,0,2026-05-25T12:20:41Z
@PrakashBrnwal,Harka ko sansad ko pad nai kharej garnus savamukh mahoday,1,2026-05-25T12:16:17Z
@lilasubedi7366,Herata pagal bhukeko,0,2026-05-25T12:16:00Z
@lilasubedi7366,Tamaasha matra garchhan yo harke  😡😡😡😡,0,2026-05-25T12:14:33Z
@jayathapa679,❤❤❤ harke ko patan nischit chha,0,2026-05-25T12:12:50Z
@sharmakishorsharma7186,3 सिटे QR मुला।।technology ले के के बनाई सक्य यो भन्य रिन लाग्छ भनेर ढुङ्गा कुट्नि अरे।,0,2026-05-25T12:11:21Z
@BasantiSalaka588,yo harke pagal le chunab aginai yesto behora dekhako ho yesta pagal KO samsadh banne like ko manxe haina testalai vote dine haruni pagal nai ho,0,2026-05-25T12:07:45Z
@BasantiSalaka588,pagal harke,0,2026-05-25T12:05:21Z
@SatakshiKarn,राम्रो गरे। ❤हर्क,0,2026-05-25T12:02:49Z
@PurnabahadurRanabhat,हर्क सरलाई रेस्टिकेट गर्न मिल्दैन? यस्तै भैराख्यो भने देश कसरी बन्छ त???,1,2026-05-25T12:02:37Z
@bhimlama6920,दिमागै नहुने मान्छेलाई भोट दिएर जिताएर बेकार,0,2026-05-25T11:54:05Z
@eeeeeee6153,यस्तालाई  कसले  नेता मान्छ र  ।,0,2026-05-25T11:39:08Z
@padamyamphu5729,Harka for law and order,0,2026-05-25T11:38:47Z
@padamyamphu5729,Harka in law and order,0,2026-05-25T11:37:56Z
@DEEKENLIMBU,हर्केको गार्ड जलेकोहो सङ्गैको साथि प्रधानमन्त्री भएर😡,0,2026-05-25T11:37:11Z
@somraj7012,हर्केलाइ केपिकोजासुसि,0,2026-05-25T11:13:25Z
@dharmaacharya9481,Das misses hospital lanu,0,2026-05-25T11:10:35Z
@jagangurung8901,"सांसद भवन मा समय अति महत्वपुर्ण हुन्छ,
हर्क राई ले यसरी सांसद भवन मा कसै लाई ब्यक्तिगत रिसिवी राखी यसरी बिरोध गर्नु गलत हो, हर्क राई लाऊ कारवाही हुनुपर्छ",0,2026-05-25T11:09:48Z
@BinodRinhong,Herdai jam satya k ho samaya aayepaxi thaa hunx,0,2026-05-25T11:07:45Z
@asimsikari5948,Yesto unpopular sansad kasto lai jitayera pathako sansad bhawan ko virus,0,2026-05-25T11:02:12Z
@AngchhojeSherpa,होइन यस्तो मान्छेको कुरा पत्ताउने को राम्रो कुरामा सपोर्ट दिन्छ भने हामी पनि तयार छौं तर तर विरोध मात्रै गरेर फाइदा छैन। ३ करोड जनताले म्यान्डेट दिएको चाहिँ के यसकै लागि दिएको😥,0,2026-05-25T11:01:57Z
@justforknow5815,News ho ki bhram😂😂😂😂,0,2026-05-25T11:00:17Z
@Robertkeerati,जे कुराको डर थियो अबो तेइ हुनुलागिरहेको छ लातो का भुत बातो से नहिमान्ता 😅😅😅।।। अति गर्नु अतिचार नगर्नु ।।।यो ३ सिटे लाई  निलम्बन गरेको राम्रो हुन्छ ।। जो कोहि आफन्त देश बिकास बिरोधि भएमा सुरुमै कारबाहि गरेको राम्रो।।प्ल्ज ।।।।जय बालेन सरकार ।।,1,2026-05-25T10:56:45Z
@santoshraisantoshrai8099,Naya kepi oli naya sarkar cheese🔔💀,0,2026-05-25T10:56:22Z
@Karnali_Hub,"जनताले परिवर्तन खोजेका थिए,तर फेरि उही शक्ति,उही संरक्षण र उही राजनीतिक खेल देख्न बाध्य भए।

“वाचा थियो ठग समात्ने, अहिले अवस्था ठग जोगाउनेजस्तो देखिँदैछ। समयले सबै हिसाब माग्नेछ।”

जब न्यायालय, राजनीति र शक्ति एउटै प्रश्नमा घेरिन्छन्, तब जनताको विश्वास सबैभन्दा बढी घाइते हुन्छ।",0,2026-05-25T10:56:01Z
@nakul_124,Harka lie herda haso lagna thalyo,0,2026-05-25T10:48:52Z
@taranathsiwakoti3217,"बल्ल हर्केले भाँडभैलाे गर्न काम पायाे । साबुन, बेसार र खानेपानीकाे हिसाब कहिले देखाउने ? कि पच भयाे ? गफ मात्रै ठुला गर्ने । जनताले तिम्राे मुल्याङ्कन गरिरहेका छन् ।",1,2026-05-25T10:48:04Z
@harishah6042,एउटा संसदले सरकारका प्रधानमन्त्रीलाई संसद प्रती जवाफदेहि बनाउन खोज्नु कुन परिभाषाले हर्कवाद भो ट्यापेको दलाल ?,0,2026-05-25T10:43:55Z
@MinaBhattarai-b5z,हर्केकाे एक मात्र उधेस्य बालेन सरकार ढाल्ने अाफु मन्त्री बन्ने 3 सिट भए पनि याे कति अराजक रघमण्ड हाे जातियर द्वन्द गराउन पुरानो पाटि र इसाई सङै मिलेकाे छ अझै यस्तो हर्केकाे अराजक राेकिदैन भने माटे सबैको पद निलम्बन गर्नुपर्छ सभामुखले,0,2026-05-25T10:37:19Z
@ranilshrestha4321,हर्क आफ्नै घर फर्क। नगर धेरै वाइहात तर्क।,0,2026-05-25T10:36:55Z
@simonmen2378,"Ek no Gamandi,Arishe,hepaha ani  jatibad 😡",0,2026-05-25T10:27:58Z
@noob-basticgamer3969,हरके को व्यवहार हेर्दा त् हरके नभएर नरके पो रहेछ ! यस्तो तुच्छ व्यवहार देखेर त् मलाई लाग्छ कि मेरो गाईहरुको गोठाले सम्म हुने लायक रहेनछ !! कठै नरके को संस्कृति 😂😂😂,0,2026-05-25T10:22:25Z
@aha7671,PM lai pani niyam samjhaune ho ki?,0,2026-05-25T10:21:56Z
@mandevchand5759,बौलाहा हर्केको के कुरा गर्नु हो,0,2026-05-25T10:18:34Z
@princevlog-x3h,timro samachar pani ghantiko ganda aayo hoi bhai asto patrakaritale dubaux timilai  sarkar jabap dehi hunu parx ki nai?,0,2026-05-25T10:18:21Z
@gomthapa6646,Gante chor pati😂😂,0,2026-05-25T10:16:30Z
@gomthapa6646,Ghante pati kam xaina😂😂,0,2026-05-25T10:14:48Z
@KrishnaKarki-n4i,Yeni haru hijo birodh gardai aayaka Hun tesaile yeni haru birodh gare ko man parauodainan.tesaile WA WA garnus tesai khas chan,0,2026-05-25T10:13:48Z
@princevlog-x3h,aba ghanti pani janx khola ma herdei jau pahile ghantile pani gareko thiyo asto tw purano party harayo aba tei lakxyan dekha pardeix hai sathi ho,0,2026-05-25T10:12:08Z
@AnitaRai-c6j,Harka le thik garyo,0,2026-05-25T10:04:32Z
@palden74,सरकार प्रमुख प्रधानमंत्री में ही अनुशासन नहीं है। न,0,2026-05-25T09:55:06Z
@riryan9394,🌸🌸🌸🌸🌺🌺🌺🌺,0,2026-05-25T09:52:02Z
@sankhagaming1,Yesto pagal lai sansad ra mananiya manidinu parne hare nepali ko bhagya,0,2026-05-25T09:51:44Z
@keshabchaudhary1635,हर्केलाई अब संसद बनाउँदैन्न हे ध्यान होस ।,0,2026-05-25T09:49:18Z
@SaritaRai-hn4gw,Balen cahi kuna naboleko,0,2026-05-25T09:47:07Z
@rajghimire2637,"३ सिटे गुइठे ले प्रधानमन्त्रीको सपना देखेको होला, कानुन पढ्दैनन कि थाहा नभएको ? सायद यो जुनिमा हर्के प्रधानमन्त्री बन्नु एउटा दिवा सपना मात्रै हो !",0,2026-05-25T09:46:53Z
@KarunaLimbu-lt7uh,घण्टी हरुजन्ताको तेक्स सहकारिलाइ दोनु रैछ अनि सद्न्मा जान्छ त,0,2026-05-25T09:38:35Z
@bhabindrapoudel9887,नैतिक  नभएको  मान्छे हरु समसद मा पुगे पछि यस्तै हो,4,2026-05-25T09:37:45Z
@rajkumarb.k3051,Nalayek phataha harke murdabad nice 👍👍 rasapa sarakar ❤❤❤❤❤,0,2026-05-25T09:34:34Z
@rajkumarb.k3051,Nalayek phataha harke murdabad nice 👍👍 rasapa sarakar ❤❤❤❤❤,0,2026-05-25T09:32:26Z
@AsmitPaudel-gs2jm,हर्के को हर्कत ठिक लागेन,0,2026-05-25T09:31:20Z
@HariSharanGajmer-z3v,"Hernus ma Balen ko kharo supporter ho..but ekchoti Balen le sambodan garda chai k jancha? @Sidakura team, Dherai Rabi ra Balen ko ando bhkta pani nahunus.",0,2026-05-25T09:30:20Z
@kr7568,"Sabaile Birod garirachan,jntale dekhi rachan, Harka le matrai birod gareko cha ra?? 🤑🤢🤮",0,2026-05-25T09:29:32Z
@PabitaWosti,Harka jhole khate ho  nepal sarakar yaslai kada karabai hos,0,2026-05-25T09:28:47Z
@PreetimaPoonmagarnee,हर्कपद भन्दा अरु कुनै विकल्प छैन,0,2026-05-25T09:27:39Z
@Diffrent_View4779,"He is just a labour, not leader!!!",0,2026-05-25T09:27:36Z
@Chitokhaber1,"निलम्बन गरेर त देखा ना
खरानी हुन्छ",0,2026-05-25T09:24:54Z
@Chitokhaber1,सहकारी ठगलाई तह लगाउने हर्क,1,2026-05-25T09:22:53Z
@Chitokhaber1,जय हर्कबाद,1,2026-05-25T09:22:21Z
@SantiThapa-b4o,हर्केले ईगाे साधेकाे हाे । बालेन प्रधानमन्त्रि भयकाे देखर मन मनै जलेकाे हर्के कहिले पागल पन देखाउछ कहिले अल्लारे पन देखाउछ,0,2026-05-25T09:20:15Z
@BishnuPun-of9gk,Satya tito hunxa mediamaanipulate gare jasto hudaina kanxa ho desh chalauna satya bolera aaja kei hudaina satya satya ho nepali janta veda vaisake....aafno bibek prayog garooo belai ma buddi aaos ghantey haru ko,0,2026-05-25T09:17:39Z
@JK_View87,एउटा मेयर चाही PM अर्को मेयार चाही नाथे संसद मात्र भन्ने सोचले जलिरहेको मान्छेलाई हर्के भनिन्छ तर हर्केको जिन्दगी जलनमा नै जान्छ,0,2026-05-25T09:09:53Z
@UBSK12,यो विदेशी दलाल हर्के muji लाई चारपाटे मोडेर देशै भरि घुमाउदा हुन्छ,0,2026-05-25T09:07:05Z
@sanjayathapa6494,When a donkey is popular he thinks of himself as a lion 😂,0,2026-05-25T09:05:10Z
@chimegrg2175,"Yo media haru pani harka ko matra news kina halnu paryo , pagal media jholey haru 🤮🤮👋",0,2026-05-25T09:01:03Z
@bims_k5251,harke lai nilamban nai garnu parx . personal ego lier sansad xirnu bhane janamatako abahelana apaman garnu ho.,0,2026-05-25T09:00:53Z
@No.1YouTubeVideo,"एउटा खुस्कट, अर्को एक्स्ट्रा VIP । यी दुवैलाई संसद बाहिर राखेर रास्वपालाई काम गर्न दिँदा कस्तो होला ? इगो भन्दा काम प्राथमिकता होस् 🙏",0,2026-05-25T09:00:02Z
@chimegrg2175,Harka pagal pipe Ra stones bokda ni thik cha mula timi 🤮🤮🤮,0,2026-05-25T09:00:02Z
@unique1shrestha280,harke lai pm chaiya x 😂,0,2026-05-25T08:59:21Z
@skdbgjsdbf,Harke haldar badar gothalo,0,2026-05-25T08:59:15Z
@TekSingh-yd2hd,Sidha kura—- please you go to pashupati parking area and make a VDO. Money has been collecting for many years over there but people including foreigners are having top time with dusty and dirty parking. What do they do that money. Please find out,0,2026-05-25T08:52:13Z
@ganeshbohara3278,हर्के पागल।,0,2026-05-25T08:51:37Z
@S_U_B_O_N_R_A_I,यो  पत्रकार झोले हो भन्ने कुरा सबैलाई थाहा छ यो च्यानल रास्वपा को हो कोहि नक्झुकिनु होला । एक तर्फी कुरा गरिरहेको छ ।एस्तो मिडिया भएपछी कहाँ बाट देश बिकास हुन्छ । थुक्छु एस्तो पत्रकारिता लाई ।,0,2026-05-25T08:51:20Z
@Random69-0,Balen muji garib mara sarkar🖕🏼 tmiharu ko kaal ho harka ..182 vs 1 ✊rsp le chai poili birod gareko birsyo ki kya ho yo sarkar le tyo chai maryadid thiyo 😡😡,0,2026-05-25T08:50:20Z
@matrikachamlagain,जय नेपाल जय घण्टी जय रवि दाइ जय बालेन सरकार🔔🔔🇳🇵,3,2026-05-25T08:49:52Z
@mbk45vlogs,Sacho bhanum bhane Daha bhako ho harka lai …. Sangai rajniti maa xireki manxe PM bho aafu Bhane samsad matra,0,2026-05-25T08:45:26Z
@premgurung380,actually k ho karan ?kina ? Bhanera po janta ko agadi reporting prastuti garne ho media ko kaam …one sided hunu bhaneya yo reporting channel,0,2026-05-25T08:42:27Z
@LimsnarenHaang,Harke le kehi naapdaina,0,2026-05-25T08:41:44Z
@MadanRai-x7d,Ghantay haru lay j garay pani thik janta ko aawaj samsad lay suni ho tihe kura samsad lay pradhan matri savamukh lai sunauni ho vanira janiko xa yo ghantay haru lay ra pani khairo khani rako xa jati badi kharanay haru,0,2026-05-25T08:39:22Z
@RaviShrestha-b7w,Qr Bata napugera ab foundation ko naam ma thagi dhanda garna khojdai xa 😂,0,2026-05-25T08:34:25Z
@ÐNW丨NembaNg,Hoina kasto khalko ho yo putrakar,0,2026-05-25T08:34:02Z
@Ausing-h6n,Chor muji lutera harke laat haanu parxa muji jhole ho hosiyar,0,2026-05-25T08:32:30Z
@shatrudhanshatrudhan1893,Desh bhakt jindabad Chor dalal jhole haru muRdabad jay desh Nepal good job Raspa Sarkar desh Philo hunu parchh go ahead Nepal Sarkar ❤❤❤,0,2026-05-25T08:31:32Z
@RanaGokul-nw3vy,Laaj ko pasaro guithy😂😂😂,0,2026-05-25T08:24:56Z
@Bhimmagar19,हर्क को हर्कत गारो छ!😻,0,2026-05-25T08:18:45Z
@ManBahadur-v2k,"हर्क साङपाङ लाई निलम्बन गर्न,,नसोचे पनि हुन्छ,सभा मुख ले,,,,यो अकल्पनीय कुरा हो,,उहाँ ले ससद मा जायज कुरो नै उठाएको छ त।",0,2026-05-25T08:18:13Z
@BishnuKatel-l1i7l,हर्क को हर्कबाद मलै चाॅही आची पुछेर फालिदिए,0,2026-05-25T08:16:47Z
@JeevanKasera-tb9je,Harke मुजिलाई दुई छापड हान्नुपर्ने,0,2026-05-25T08:11:07Z
@BishnuKatel-l1i7l,हर्क यो सरकार असफल गराउन न्वारन देखीको बल लगाई रहेको देखिन्छ,2,2026-05-25T08:09:44Z
@chandravlogs1232,Chetwaani k ka laagi,0,2026-05-25T08:06:38Z
@haripant8559,Harke Saudi tira farke timro Kam xain Nepal ma pagal,0,2026-05-25T08:05:34Z
@sudhirkandel2259,"ranibari ma k garera gais tha hola ni harke
thukka",0,2026-05-25T08:05:28Z
@sudhirkandel2259,"harke jattha kulli huna layek. nilambait garenu parcha
jattho. khatte tyo muji pm ta napis harke",0,2026-05-25T08:04:36Z
@sumankhadka4185,Harke Lai aba public dulyaii dine bela bayeko Cha samaj badne yesta durga prasai jasta le afno faida ko lagi je ni garcha,0,2026-05-25T08:04:33Z
@Subiralemagar,Good Harka,0,2026-05-25T08:03:05Z
@साम्दीतुपकुलुङ,balenko galat chai xa ki xain? Tyo vannupardain nispaxya patrakarle😅,1,2026-05-25T08:02:37Z
@SanjayaLimbu1,Harka bhaneko Raja ho. Ghamandi ra Khedo khanne haruko Raja. 😂🤣,0,2026-05-25T07:59:06Z
@Pramod-t4s,BALEN chahin ko ho ni - sasand maa nai naaune ???????????????????,0,2026-05-25T07:58:21Z
@BhumikaRai-e5c,Thula le j yarda ni hune sana lai chai niyam kanun ko dharma k garnu hau patrakar pani bikri vayepaxi yasari nai ektarfi report banaunu uchit hain,0,2026-05-25T07:54:26Z
@dr.kiranadhikari2455,"Loktantra , pratipakxya ko arthaa nabujhne nepali veda janta harule harka sir lai sajiloi bujhna sakdoinan ..
Veda nepali janta haru Birod garna vanda agadi loktantra , pratipakxya ko artha bujh pahila.

Harka sir🫡🫡",0,2026-05-25T07:54:25Z
@amanrout354,"संसदमा कुर्चि हानाहान् गरेकाे समय बिर्सिस,सभामुख अर्याल,तँ सभामुख ले सचिबालये लाई साेध्न पर्ने भय,सुभास नेवाङ् लाई स्वतन्त्र युबाहरुले किन मारेकाे,सुभाष नेवाङ् काे हत्या भयकाेछ,सुन रासाेपा,तिमरु पार्टी हैन यक यक जना हाै राजा झै भयका,अब मुलाकट्नेझै गरि काट्नेकि काेरा हान्नेकि,उस दिन नजिक नजिक अाईरछ,हर्क साम्पाङ् सकलि म हु,तँ संसद अल दरबार हत्याकाण्ड र देश जलाउने मा छस्,नेपाल मा त पहिलाे ज्ञानेन्द्र शाह नकाप धारि झुन्डिने रछर यी अनैतिक भयकाे,बुझिस तँ ज्ञानेन्द्र शाह लाईत कुल्चि कुल्चिमार्न पर्छ,भबिस्य तेसरि मार्न पर्छ बुझिस बिज केपि यउटा हाे नसकलि अरु हैन रछ तँ पनि राजा कुकुर यक पटक हैन सय पटक गणित रेकर्ड देखाउदा नमान्ने,कामी,शिंह दरबार जलाउछुभन्नेले जलाउदा दाेस छैन अपराध छैन,माेदि यउटा दलित हेरेर खेल लम्बायकाे तँ नकाप ज्ञानेन्द्र शाह फेमलि,जिउदाे जलाईदिने दिन अाउछ,बुझिस,सकलि जलेकाे पनि हाेला,तेराे निवामाबलि,सभामुख सब रेकर्ड मा छस् पखन रन्डि पुत्र हाे,पहिला चाईनाले गणित हेरेर मेराे हजुर बुबाकाे हक अधिकार दियर,हेरेर २०२१/1964 बुझेर,मेराे अधिकार दिय तिमरुकाे दशा के गराैला,मलई इन्डिया चाईना संग सबाल छैन तिमरु नेपाली संसद नेपाल जलाउने राजा मार्ने,र थपना राखेकाे राजा फाल्ने,हरुकाे दशा के हाेला,देख्छस्,रबि बालेन अर्याल साेर्णिम,२०२१ साल 1964 साल माहाकाल छ,र सेक्रेट छ भनेर नाईठिङ्गल चराकाे पाठ पढिनस् संसद त्याे माेदि बिज पापि नेपाल इन्डिया यउटै हाे भनेर नमानेर,हिन्दी फिलिममा कयाै मन्त्री हरुलाइ पुलिस ले अगुठा छाप नंमर नंमर केहाे भन्दा हागुजि थाहानभयकाे,र लात लात हानेकाे माेदि ले जय शङ्खर ले अमित साहा ले बुझेकाे रहेनछ,जनसंख्या धेरै भयर हैन नकाप हाजि वजि माेदि,४ सहिद हेर्लास् २००६ साल मा र अंग्रेजी 2006 साल पनि हेर,दशा के हाेला माेदि,तँ माेदि भन्नुनै हिन्दी भाषि सबै हुन् ब्यापारी भन् या बैज्ञानिक लिखितछ,नमाने खरानी हुन्छस्,लाटाे र बहिराेकाे पाठ पढिनस् लेखेर दे बाेलेकाे सुन्दैनन् बुझ्दैनन् भनेर पढिनस् र ब्ल्याक बाेड्मा सर मिस ले लेख्न लगायनन्,लाटा र बहिरा लाई भनेर लेखेपछि सर लाटाे बहिराे कनेर हाहाहा गर्दै नाटक गर्दै हासेका,र उनी हरुले झन् राम्रो लेखेर दियका,पढिस खाम चिट्ठी समय पाठमा,गईस् माेदि,झुन्डिन तयार हुने,राजनीतिक शिक्षा गणित इतिहास रेकर्ड ग्रन्थ  बिज्ञान हैन भनेर लाटाे बहिराे काे पाठमा पढिनस्,जिब्रो काट्छु कयाै संसद नेता हरुकाे,मेन तँ माेदि हाेस,अपराधी चाईना मेराे छिमेकि देश हाे २०२१ सालकाे,र बरणमा मराे नेपाल काे छिमेकि देश हाे ईन्डिया पाकिस्तान बंगलादेश भुटान के राजनीतिक थाल हाे नागरिक हरुकाे रगत पिउने,तँ बिज माेदि पखन तँ माेरेपनि तेरा हाजि वजि हिन्दी भाषि हरुकाे कुन दशा हुन्छ अाउने समयमा,यी नेपाली संसदनै हैन नेपाल मा राजनीतिक गर्नपाउदैनन्,लिखितछ,भुमिनै छैन केकाे राजनीतिक २०२० साल के हेर,अनि राजनीतिक गर्न भुमि चाहिदैन,नत समाउने हागाछ नत टेक्ने खुड्किलाछ,तिमरु राजनीतिक हैन हाे,पखन माेदि ४ सहिद समणझाउदैछ,चाईनाकाे सिजिङ्पिङ् गणित रेकर्ड 1964 नमाने झुन्डाउछु भनेर कयाै पटक लेखेर दियकाेछु,भने तँ अंग्रेज काे दास,परिचालित,नकाप हुल रहलास् माेदि माेदि बनाउदै लाखाै माेदि झुन्डाउछु १ घन्टा भित्र २०२१ साल नमाने नेपाल ईन्डिया यउटैहाे भनेर नमाने,तेराे के दशा गराैला माेदि बाेडर खुल्ला हेर कुन नेपाल कुन् ईन्डिया २०२१ साल हेर कुन नेपाल कुन बंगलादेश ,मार्दिन्छु माेदि द्राेपति,जय नेपाल जय श्रीराम 🌍️🐄🔱🎧️🇳🇵🇳🇵🇳🇵🇳🇵🇳🇵🌄🔬🌬️🔥",1,2026-05-25T07:54:16Z
@surajgiri4235,Harka = India's Kejriwal😅,0,2026-05-25T07:51:59Z
@maharamegh,Go Ahead Balen. We are with you❤,1,2026-05-25T07:50:50Z
@ArcyyBlox,हर्के भन्दा गाऊको जोत्ने हलि को चेतनाको स्तर र देस जनता प्रतिको माया धेरै छ,0,2026-05-25T07:43:35Z
@JeniSerpaili,Khatey harkey😡😡,0,2026-05-25T07:42:21Z
